Topic,Link,Time
CNG Commends Governor Radda’s Efforts In Tackling Insecurity,https://www.channelstv.com/2023/10/13/cng-commends-governor-raddas-efforts-in-tackling-insecurity/,18 mins ago
Hamas Rejects Israel Order To Evacuate North Gaza,https://www.channelstv.com/2023/10/13/hamas-rejects-israel-order-to-evacuate-north-gaza/,1 hour ago
"Lagos Govt Shuts Mile 12, Owode Onirin Markets Over Environmental Breaches",https://www.channelstv.com/2023/10/13/lagos-govt-shuts-mile-12-owode-onirin-markets-over-environmental-breaches/,4 hours ago
Hamas Says 13 Hostages Killed In Israel Strikes On Gaza,https://www.channelstv.com/2023/10/13/hamas-says-13-hostages-killed-in-israel-strikes-on-gaza/,4 hours ago
"Tinubu Appoints New CEOs For ITF, SON, CAC, 11 Others",https://www.channelstv.com/2023/10/13/tinubu-appoints-new-ceos-for-itf-son-cac-11-others/,4 hours ago
Troops Rescue 17 Kidnapped Persons In Kebbi,https://www.channelstv.com/2023/10/13/troops-rescue-17-kidnapped-persons-in-kebbi/,5 hours ago
We’re Monitoring Impact Of Israel-Hamas War On World Economy – IMF,https://www.channelstv.com/2023/10/13/were-monitoring-impact-of-israel-hamas-war-on-world-economy-imf/,5 hours ago
Otti Flags Off Reconstruction Of 6.7km Port Harcourt Road In Aba,https://www.channelstv.com/2023/10/13/otti-flags-off-reconstruction-of-6-7km-port-harcourt-road-in-aba/,5 hours ago
Two Die As Storey Building Collapses In Osun,https://www.channelstv.com/2023/10/13/two-die-as-storey-building-collapses-in-osun/,6 hours ago
Israel Army Tells Gaza City Residents To Evacuate To South,https://www.channelstv.com/2023/10/13/israel-army-tells-gaza-city-residents-to-evacuate-to-south/,7 hours ago
